{
  "name": "Iridium NEXT",
  "short": "Iridium",
  "description": "66 operationele satellieten (plus 9 reservesatellieten in de baan) op 780 km in 6 polaire vlakken — vervanger van de tweede generatie voor de oorspronkelijke Iridium-vloot uit 1998. Spraak, data, communicatie tussen machines. Ruggengraat van het GMDSS (Global Maritime Distress and Safety System); je satelliettelefoon midden op een afgelegen oceaan werkt via dit systeem.",
  "scale_fact": "Een Iridium 33-satelliet botste met de verlaten Cosmos 2251 op 776 km in 2009 — de eerste bekende satellietbotsing in de geschiedenis."
}
