{
  "name": "БеиДоу Цонстеллатион",
  "short": "БеиДоу",
  "description": "Кинески глобални навигациони сателитски систем. 46+ сателита у орбитама МЕО, __АЦР0__ и ИГСО. Пружа глобалну покривеност од 2020. Такође функционише и као сервис за размену порука — сателити преносе кратке текстове.",
  "scale_fact": "БеиДоу-ова архитектура типа три орбите је јединствена — истовремено користи сателите на три различите висине."
}
