{
  "name": "Clementine",
  "short": "Clementine",
  "description": "Misión conjunta NASA/DoD de la Iniciativa de Defensa Estratégica, 1994. Pasó diez semanas cartografiando la Luna en 11 bandas espectrales —el primer mapa multispectral global sistemático. Las mediciones de radar biestático en el polo sur produjeron los primeros indicios de hielo de agua polar, posteriormente confirmados por Lunar Prospector y Chandrayaan-1.",
  "scale_fact": "Órbita polar lunar a ~425 km de altitud. Primer indicio de agua lunar —el descubrimiento que motiva todas las misiones modernas del polo sur, incluida Artemis III."
}
