{
  "name": "Clementine",
  "short": "Clementine",
  "description": "Gemeinsame Mission NASA/DoD Strategic Defense Initiative, 1994. Verbrachte zehn Wochen damit, den Mond in 11 Spektralbändern zu kartieren – die erste systematische globale Multispektralkarte. Bistatische Radarmessungen am Südpol ergaben erste Hinweise auf polares Wassereis, die später von Lunar Prospector und Chandrayaan-1 bestätigt wurden.",
  "scale_fact": "Mondpolarumlaufbahn ~425 km Höhe. Erster Hinweis auf Mondwasser – die Entdeckung, die jede moderne Südpolmission, einschließlich Artemis III, motiviert."
}
