{
  "name": "СМАРТ-1",
  "short": "СМАРТ-1",
  "description": "__АЦР0__ прва лунарна мисија, 2003-2006. Коришћени соларно-електрични (јонски) погон за излазак из геостационарне трансферне орбите у лунарно снимање - 14-месечни транзит са економичном потрошњом горива који је био пионир у путањама ниског потиска за касније међупланетарне мисије __АЦР0__. Намерно је утицао на површину Месеца 2006.",
  "scale_fact": "Поларна орбита на ~470 км надморске висине. Прва оперативна употреба јонског погона за лунарну мисију — шаблон за __АЦР0__ касније мисије БепиЦоломбо и Хера у дубоком свемиру."
}
