{
  "name": "Sentinel (Copernicus)",
  "short": "Sentinel",
  "description": "यूरोप का प्रमुख पृथ्वी-निरीक्षण कार्यक्रम — Sentinel-1 (C-band रडार इमेजिंग), Sentinel-2 (मल्टीस्पेक्ट्रल ऑप्टिकल), Sentinel-3 (महासागर + भूमि), Sentinel-5P (वायुमंडलीय रसायन विज्ञान), Sentinel-6 (अल्टीमेट्री)। सभी सूर्य-तुल्यकालिक लगभग 700 km पर। मुक्त + खुली डेटा नीति।",
  "scale_fact": "इस दशक में आपने समाचारों में देखे गए हर जंगल की आग, बाढ़, तेल रिसाव, और वन-क्षति की चेतावनी Sentinel छवि से आई है।"
}
