{
  "name": "OneWeb",
  "short": "OneWeb",
  "description": "648 satellieten op 1.200 km in 12 polaire baanvlakken — LEO-breedband van de eerste generatie. Sinds de fusie in 2023 geëxploiteerd door Eutelsat OneWeb. Polaire banen geven dekking van pool tot pool, die de Starlink-schillen met een middelhoge inclinatie niet kunnen bereiken.",
  "scale_fact": "OneWeb koos voor 1.200 km — twee keer de hoogte van Starlink — om latentievertragingen door langere signaaltrajecten te verminderen. Afweging: moeilijker uit de baan te brengen aan het einde van de levensduur."
}
